{
  "schemaVersion": "1.0",
  "video": {
    "id": "photosynthesis-lecture",
    "title": "광합성의 원리",
    "durationSec": 1800,
    "segments": [
      {
        "id": "segment-1",
        "startSec": 0,
        "endSec": 360,
        "text": "광합성은 식물이 빛 에너지를 받아 스스로 양분을 만드는 과정이다."
      },
      {
        "id": "segment-2",
        "startSec": 360,
        "endSec": 720,
        "text": "잎의 엽록체가 빛 에너지를 흡수하면서 광합성이 시작된다."
      },
      {
        "id": "segment-3",
        "startSec": 720,
        "endSec": 1080,
        "text": "흡수한 에너지로 물이 분해되고 이 과정에서 산소가 함께 나온다."
      },
      {
        "id": "segment-4",
        "startSec": 1080,
        "endSec": 1440,
        "text": "이산화 탄소가 결합해 포도당이 만들어지고 식물의 양분이 된다."
      },
      {
        "id": "segment-5",
        "startSec": 1440,
        "endSec": 1800,
        "text": "광합성은 빛 에너지를 화학 에너지로 바꾸어 저장하는 과정이다."
      }
    ]
  },
  "room": {
    "id": "photosynthesis-room",
    "title": "빛이 남은 실험실",
    "theme": "잎 표본과 관찰 기록이 남아 있는 식물 실험실",
    "initialViewId": "overview",
    "declaredPuzzleCount": 5,
    "views": [
      {
        "id": "overview",
        "kind": "OVERVIEW",
        "label": "방 전체",
        "backgroundAssetKey": "room-overview",
        "navigation": [
          {
            "targetViewId": "bookshelf",
            "label": "책장 확대",
            "rect": [
              0.04,
              0.12,
              0.25,
              0.68
            ]
          },
          {
            "targetViewId": "wall",
            "label": "벽면 확대",
            "rect": [
              0.31,
              0.1,
              0.25,
              0.45
            ]
          },
          {
            "targetViewId": "drawer",
            "label": "서랍 확대",
            "rect": [
              0.58,
              0.42,
              0.17,
              0.38
            ]
          },
          {
            "targetViewId": "desk",
            "label": "책상 확대",
            "rect": [
              0.72,
              0.26,
              0.24,
              0.56
            ]
          }
        ]
      },
      {
        "id": "bookshelf",
        "kind": "CLOSEUP",
        "label": "자료 책장",
        "backgroundAssetKey": "bookshelf-closeup",
        "backToViewId": "overview"
      },
      {
        "id": "wall",
        "kind": "CLOSEUP",
        "label": "관찰 기록 벽",
        "backgroundAssetKey": "wall-closeup",
        "backToViewId": "overview"
      },
      {
        "id": "drawer",
        "kind": "CLOSEUP",
        "label": "잠긴 표본 서랍",
        "backgroundAssetKey": "drawer-closeup",
        "backToViewId": "overview"
      },
      {
        "id": "desk",
        "kind": "CLOSEUP",
        "label": "연구자의 책상",
        "backgroundAssetKey": "desk-closeup",
        "backToViewId": "overview"
      }
    ]
  },
  "items": [
    {
      "id": "book-hap",
      "label": "‘합’ 책",
      "assetKey": "book",
      "displayText": "합",
      "description": "‘합’이 적힌 작은 책이다.",
      "pickupText": "책상 모서리에서 ‘합’이 적힌 책을 발견했다.",
      "source": {
        "type": "SCENE",
        "viewId": "desk",
        "rect": [
          0.1,
          0.62,
          0.15,
          0.18
        ]
      }
    },
    {
      "id": "book-han",
      "label": "‘한’ 책",
      "assetKey": "book",
      "displayText": "한",
      "description": "‘한’이 적힌 책이다.",
      "pickupText": "책장 아래에서 ‘한’이 적힌 책을 발견했다.",
      "source": {
        "type": "SCENE",
        "viewId": "bookshelf",
        "rect": [
          0.08,
          0.68,
          0.15,
          0.2
        ]
      }
    },
    {
      "id": "book-ham",
      "label": "‘함’ 책",
      "assetKey": "book",
      "displayText": "함",
      "description": "‘함’이 적힌 책이다.",
      "pickupText": "서랍 위에서 ‘함’이 적힌 책을 발견했다.",
      "source": {
        "type": "SCENE",
        "viewId": "drawer",
        "rect": [
          0.7,
          0.18,
          0.16,
          0.2
        ]
      }
    },
    {
      "id": "event-light",
      "label": "빛 흡수 카드",
      "assetKey": "story-card",
      "displayText": "흡수",
      "description": "엽록체가 빛 에너지를 흡수하는 단계다.",
      "pickupText": "책 사이에서 ‘빛 흡수’ 단계 카드를 찾았다.",
      "source": {
        "type": "SCENE",
        "viewId": "bookshelf",
        "rect": [
          0.75,
          0.62,
          0.15,
          0.2
        ]
      }
    },
    {
      "id": "event-split",
      "label": "물 분해 카드",
      "assetKey": "story-card",
      "displayText": "분해",
      "description": "흡수한 에너지로 물이 분해되는 단계다.",
      "pickupText": "벽면 틈에서 ‘물 분해’ 단계 카드를 찾았다.",
      "source": {
        "type": "SCENE",
        "viewId": "wall",
        "rect": [
          0.14,
          0.68,
          0.16,
          0.2
        ]
      }
    },
    {
      "id": "event-sugar",
      "label": "포도당 합성 카드",
      "assetKey": "story-card",
      "displayText": "합성",
      "description": "이산화 탄소가 결합해 포도당이 만들어지는 단계다.",
      "pickupText": "책상 위 기록에서 ‘포도당 합성’ 단계 카드를 찾았다.",
      "source": {
        "type": "SCENE",
        "viewId": "desk",
        "rect": [
          0.66,
          0.64,
          0.16,
          0.2
        ]
      }
    },
    {
      "id": "event-respiration",
      "label": "호흡 단계 카드",
      "assetKey": "story-card",
      "displayText": "호흡",
      "description": "광합성이 아니라 호흡에 해당하는 잘못된 단계 카드다.",
      "pickupText": "서랍 옆에서 ‘호흡’ 단계 카드를 찾았다.",
      "source": {
        "type": "SCENE",
        "viewId": "drawer",
        "rect": [
          0.12,
          0.62,
          0.16,
          0.2
        ]
      }
    },
    {
      "id": "key-chloroplast",
      "label": "엽록체 열쇠",
      "assetKey": "key",
      "displayText": "엽록체",
      "description": "‘엽록체’라고 새겨진 작은 열쇠다.",
      "pickupText": "완성된 책장 뒤에서 ‘엽록체’ 열쇠가 나타났다.",
      "source": {
        "type": "PUZZLE_REWARD",
        "puzzleId": "puzzle-1",
        "viewId": "bookshelf",
        "rect": [
          0.43,
          0.7,
          0.14,
          0.18
        ]
      }
    },
    {
      "id": "key-mitochondria",
      "label": "미토콘드리아 열쇠",
      "assetKey": "key",
      "displayText": "미토콘드리아",
      "description": "‘미토콘드리아’라고 적힌 열쇠다.",
      "pickupText": "벽면 아래에서 ‘미토콘드리아’ 열쇠를 찾았다.",
      "source": {
        "type": "SCENE",
        "viewId": "wall",
        "rect": [
          0.66,
          0.68,
          0.14,
          0.18
        ]
      }
    },
    {
      "id": "key-vacuole",
      "label": "액포 열쇠",
      "assetKey": "key",
      "displayText": "액포",
      "description": "‘액포’라고 적힌 열쇠다.",
      "pickupText": "책상 아래에서 ‘액포’ 열쇠를 찾았다.",
      "source": {
        "type": "SCENE",
        "viewId": "desk",
        "rect": [
          0.84,
          0.7,
          0.12,
          0.16
        ]
      }
    },
    {
      "id": "message-energy",
      "label": "에너지 전환 카드",
      "assetKey": "message-card",
      "displayText": "전환",
      "description": "빛 에너지를 화학 에너지로 바꾸어 저장한다는 설명이다.",
      "pickupText": "열린 서랍 안에서 ‘에너지 전환’ 결론 카드를 발견했다.",
      "source": {
        "type": "PUZZLE_REWARD",
        "puzzleId": "puzzle-3",
        "viewId": "drawer",
        "rect": [
          0.42,
          0.52,
          0.18,
          0.2
        ]
      }
    },
    {
      "id": "message-heat",
      "label": "열 방출 카드",
      "assetKey": "message-card",
      "displayText": "열 방출",
      "description": "흡수한 빛 에너지가 모두 열로 방출된다는 설명이다.",
      "pickupText": "책상 위에서 ‘열 방출’ 결론 카드를 찾았다.",
      "source": {
        "type": "SCENE",
        "viewId": "desk",
        "rect": [
          0.32,
          0.66,
          0.17,
          0.18
        ]
      }
    },
    {
      "id": "message-fixed",
      "label": "에너지 불변 카드",
      "assetKey": "message-card",
      "displayText": "불변",
      "description": "빛 에너지가 다른 형태로 바뀌지 않는다는 설명이다.",
      "pickupText": "책장 위에서 ‘에너지 불변’ 결론 카드를 찾았다.",
      "source": {
        "type": "SCENE",
        "viewId": "bookshelf",
        "rect": [
          0.58,
          0.12,
          0.17,
          0.18
        ]
      }
    },
    {
      "id": "safe-token-1",
      "label": "흡수 토큰",
      "assetKey": "concept-token",
      "displayText": "흡수",
      "description": "금고에 사용할 수 있는 첫 번째 개념 토큰이다.",
      "pickupText": "첫 퍼즐의 보상으로 ‘흡수’ 토큰이 나타났다.",
      "source": {
        "type": "PUZZLE_REWARD",
        "puzzleId": "puzzle-1",
        "viewId": "bookshelf",
        "rect": [
          0.8,
          0.12,
          0.14,
          0.16
        ]
      }
    },
    {
      "id": "safe-token-2",
      "label": "분해 토큰",
      "assetKey": "concept-token",
      "displayText": "분해",
      "description": "금고에 사용할 수 있는 두 번째 개념 토큰이다.",
      "pickupText": "벽면 퍼즐 뒤에서 ‘분해’ 토큰이 나타났다.",
      "source": {
        "type": "PUZZLE_REWARD",
        "puzzleId": "puzzle-2",
        "viewId": "wall",
        "rect": [
          0.82,
          0.14,
          0.13,
          0.16
        ]
      }
    },
    {
      "id": "safe-token-3",
      "label": "합성 토큰",
      "assetKey": "concept-token",
      "displayText": "전환",
      "description": "금고에 사용할 수 있는 세 번째 개념 토큰이다.",
      "pickupText": "열린 서랍 안에서 ‘합성’ 토큰이 나타났다.",
      "source": {
        "type": "PUZZLE_REWARD",
        "puzzleId": "puzzle-3",
        "viewId": "drawer",
        "rect": [
          0.7,
          0.52,
          0.14,
          0.16
        ]
      }
    },
    {
      "id": "safe-token-4",
      "label": "저장 토큰",
      "assetKey": "concept-token",
      "displayText": "저장",
      "description": "금고에 사용할 수 있는 네 번째 개념 토큰이다.",
      "pickupText": "책상의 기록판에서 ‘저장’ 토큰이 나타났다.",
      "source": {
        "type": "PUZZLE_REWARD",
        "puzzleId": "puzzle-4",
        "viewId": "desk",
        "rect": [
          0.5,
          0.16,
          0.14,
          0.16
        ]
      }
    },
    {
      "id": "exit-key",
      "label": "탈출 열쇠",
      "assetKey": "exit-key",
      "displayText": "EXIT",
      "description": "강의실의 마지막 문을 여는 열쇠다.",
      "pickupText": "금고 안에서 탈출 열쇠가 빛나고 있다.",
      "source": {
        "type": "PUZZLE_REWARD",
        "puzzleId": "puzzle-5",
        "viewId": "desk",